Часть тела / упражнение (Eng),Робочі м'язи / суглоби,Muscle in English,Min Age,Опис UA дорослі,Description (Eng),Частина тіла / вправа (Ukr),Опис UA діти,,ID,Записані,Редаговані,Доопрацьовані,,Інвентар,Розігрів,Сила,Гнучкість,Швидкість,Витривалість,Спритність / Координація,Складність,Animation
Crane with hip drainage,"Великий сідничний м'яз, Біцепс стегна","Gluteus maximus, biceps femoris",8+,"Встань рівно на одну ногу, зберігай 3 точки опори. Коліно опорної ноги злегка зігни, спина рівна. Нахились вперед (за рахунок тазостегнового суглобу, на скільки можливо, щоб спина залишалась рівною), тягнися руками вперед, вільною ногою назад. Затримайся у положенні ""натягнутого лука"", Починай повертати таз опорною ногою, ніби відкриваєш книгу. В цей момент активно працює сідниця опорної ноги. Намагайся не ставити вільну ногу на опору. Повтори це ж на іншу ногу.","Get up exactly one leg, keep 3 points of support. The knee of the support leg is slightly bent, the back is flat. They lean forward (due to the hip joint, as much as possible to keep the back left), stretching with your arms forward, free leg back. Hold in the ""stretched bow"" position, start turning the pelvis with a support leg, as if you were opening a book. At this point, the buttock of the support leg is actively working. Try not to put a free foot on the support. Repeat is the other leg.",Журавель з відведенням стегна,"Встань рівно на одну ногу, зберігай 3 точки опори. Коліно опорної ноги злегка зігни, спина рівна. Нахились вперед (за рахунок тазостегнового суглобу, на скільки можливо, щоб спина залишалась рівною), тягнися руками вперед, вільною ногою назад. Затримайся у положенні ""натягнутого лука"", Починай повертати таз опорною ногою, ніби відкриваєш книгу. В цей момент активно працює сідниця опорної ноги. Намагайся не ставити вільну ногу на опору. Повтори це ж на іншу ногу.",1,Glutes_65,🎬,🟢,,,0,,х,,,,,hard,
Lifting from z-sit,"Великий сідничний м'яз, Середній сідничний м'яз, Малий сідничний м'яз","Gluteus maximus, gluteus medius, gluteus minor",5+,"Сядь у положення Z-сіду (сядь на тазові кістки, ноги зігни ширше ширини плечей і з цього положення поклади коліна на підлогу). Видихаючи, піднімись за рахунок сили сідничних м'язів.","Sit in the z-sitting position (sit on the pelvic bones, bend your legs wider than your shoulders width and from this position put your knee on the floor). Exhaled, rise by the strength of the gluteal muscles.",Піднімання з Z-сіду,"Сядь у положення Z-сіду (сядь на тазові кістки, ноги зігни ширше ширини плечей і з цього положення поклади коліна на підлогу). Видихаючи, піднімись за рахунок сили сідничних м'язів.",1,Glutes_66,🎬,🟢,,,0,,х,х,,,,easy,
Good morning,Великий сідничний м'яз,Gluteus maximus,8+,"Встань рівно, ноги на ширині плечей. Руки постав за вуха, розведи лікті всторони. Коліна злегка зігни. Спина рівна. Видихаючи, нахиляйся вперед, за рахунок тазостегнового суглобу, на скільки можливо, щоб спина залишалась рівною.","Get flat, legs at shoulder width. Hands put your ears, spread the elbows of the westerns. Knees bend slightly. The back is flat. Exhaling, lean forward, due to the hip joint, as much as possible to keep your back flat.",Добрий ранок,"Встань рівно, ноги на ширині плечей. Руки постав за вуха, розведи лікті всторони. Коліна злегка зігни. Спина рівна. Видихаючи, нахиляйся вперед, за рахунок тазостегнового суглобу, на скільки можливо, щоб спина залишалась рівною.",1,Glutes_67,🎬,🟢,,,0,х,х,,,,,easy,
Good morning with rubber,Великий сідничний м'яз,Gluteus maximus,8+,"Одягни резинку над колінами. Встань рівно, ноги на ширині плечей. Руки постав за вуха, розведи лікті всторони. Коліна злегка зігни. Спина рівна. Видихаючи, нахиляйся вперед, за рахунок тазостегнового суглобу, на скільки можливо, щоб спина залишалась рівною.","Wear a rubber band over your knees. Get flat, legs at shoulder width. Hands put your ears, spread the elbows of the westerns. Knees bend slightly. The back is flat. Exhaling, lean forward, due to the hip joint, as much as possible to keep your back flat.",Добрий ранок з резинкою,"Одягни резинку над колінами. Встань рівно, ноги на ширині плечей. Руки постав за вуха, розведи лікті всторони. Коліна злегка зігни. Спина рівна. Видихаючи, нахиляйся вперед, за рахунок тазостегнового суглобу, на скільки можливо, щоб спина залишалась рівною.",,Glutes_68,,,,,резинка,,х,,,,,easy,
A good morning with a stepping step,Великий сідничний м'яз,Gluteus maximus,8+,"Одягни резинку над колінами. Встань рівно. Руки постав за вуха, розведи лікті всторони. Коліна злегка зігни. Спина рівна. Видихаючи, зроби крок всторону, на ширину плечей. Нахиляйся вперед, за рахунок тазостегнового суглобу, на скільки можливо, щоб спина залишалась рівною. Розгинаючись пристав ногу. Крокуй почергово вправо і вліво.","Wear a rubber band over your knees. Get up straight. Hands put your ears, spread the elbows of the westerns. Knees bend slightly. The back is flat. Exhaling, take a step of the width, the width of the shoulders. Lean forward, due to the hip joint, as much as possible for the back to remain flat. Standing his foot. Step alternately to the right and left.",Добрий ранок з приставним кроком,"Одягни резинку над колінами. Встань рівно. Руки постав за вуха, розведи лікті всторони. Коліна злегка зігни. Спина рівна. Видихаючи, зроби крок всторону, на ширину плечей. Нахиляйся вперед, за рахунок тазостегнового суглобу, на скільки можливо, щоб спина залишалась рівною. Розгинаючись пристав ногу. Крокуй почергово вправо і вліво.",1,Glutes_69,🎬,🟢,,,0,х,х,,,,,medium,
Putting steps with a rubber band + mah westone,"Великий сідничний м'яз, Малий сідничний м'яз, Грушоподібний м'яз","Large, small, pear-shaped gluteal muscles",6+,"Одягни резинку над колінами. Встань рівно, коліна злегка зігни, відведи таз назад. Спина рівна. Руки збери в замок пред грудьми. Зроби приставний крок всторону (крокуй перекатом з п'ятки на носок) + мах всторону (за рахунок сили сідничних м'язів). Повтори це ж саме в іншу сторону на іншу ногу. Крокуй почергово вправо і вліво. ","Wear a rubber band over your knees. Get straight, knees slightly, take the pelvis back. The back is flat. Collect your hands in a lock. Make a step of the Ustrone (step from the heel to the sock) + stroke (due to the strength of the gluteal muscles). Repeat is the same thing on the other side to the other leg. Step alternately to the right and left.",Приставні кроки з резинкою + мах всторону,"Одягни резинку над колінами. Встань рівно, коліна злегка зігни, відведи таз назад. Спина рівна. Руки збери в замок пред грудьми. Зроби приставний крок всторону (крокуй перекатом з п'ятки на носок) + мах всторону (за рахунок сили сідничних м'язів). Повтори це ж саме в іншу сторону на іншу ногу. Крокуй почергово вправо і вліво. ",,Glutes_70,,,,,резинка,,х,,,,,medium,
Step Crops,"Великий сідничний м'яз, Малий сідничний м'яз, Грушоподібний м'яз","Large, small, pear-shaped gluteal muscles",4+,"Одягни резинку на згин гомілковостопних суглобів (над кросівками). Постав ноги так, щоб резинка була натягнута. Коліна злегка зігни, відведи таз назад. Спина рівна. Приставляй ноги одна до одної. Крокуй перекатом з п'ятки на носок. Максимально натягуй резинку.","Put the rubber band on the bend of the ankle joints (above the sneakers). Put your feet so that the rubber is stretched. Knees bend slightly, take the pelvis back. The back is flat. Put your feet to each other. Crock from the heel to the toe. Maximum tighten the rubber band.",Step-кроки ,"Одягни резинку на згин гомілковостопних суглобів (над кросівками). Постав ноги так, щоб резинка була натягнута. Коліна злегка зігни, відведи таз назад. Спина рівна. Приставляй ноги одна до одної. Крокуй перекатом з п'ятки на носок. Максимально натягуй резинку.",,Glutes_71,,,,,резинка,х,х,,,,х,easy,
Walking with rubber with a cross tilt + back forward,"Великий сідничний м'яз, Малий сідничний м'яз, Грушоподібний м'яз","Large, small, pear-shaped gluteal muscles",8+,"Одягни резинку на згин гомілковостопних суглобів (над кросівками). Постав ноги так, щоб резинка була натягнута. Крокуй вперед, перекатом з п'ятки на носок, ступні розвертай всторони. На кожен крок нахиляйся, тягнучись рукою до протилежної ступні, відводь таз назад за рахунок тазостегнових суглобів. Зберігай рівне положення спини. Повтори це ж, ідучи спиною вперед.","Put the rubber band on the bend of the ankle joints (above the sneakers). Put your feet so that the rubber is stretched. Step forward, roll from the heel to the sock, the feet spread the wastrons. For each step, lean your hand to the opposite foot, take the pelvis back at the expense of the hip joints. Keep your back position. Repeat is the same, going with your back forward.",Ходьба з резинкою із схресним нахилом  + спиною вперед,"Одягни резинку на згин гомілковостопних суглобів (над кросівками). Постав ноги так, щоб резинка була натягнута. Крокуй вперед, перекатом з п'ятки на носок, ступні розвертай всторони. На кожен крок нахиляйся, тягнучись рукою до протилежної ступні, відводь таз назад за рахунок тазостегнових суглобів. Зберігай рівне положення спини. Повтори це ж, ідучи спиною вперед.",,Glutes_72,,,,,резинка,,х,,,,х,medium,
The ridge step,"Великий сідничний м'яз, Середній сідничний м'яз, Малий сідничний м'яз",Gluteus,6+,"Переступай з ноги на ногу стрибком, з п'ятки на носок, ступні розвертай всторони. Намагайся якнайдалі стрибнути всторону-вперед, тягнися рукою до протилежної ступні.","Transfer from your foot to foot, from the heel to the sock, the feet spread the westerns. Try to jump as far as possible to the opposite foot as far as possible.",Коньковий крок,"Переступай з ноги на ногу стрибком, з п'ятки на носок, ступні розвертай всторони. Намагайся якнайдалі стрибнути всторону-вперед, тягнися рукою до протилежної ступні.",1,Glutes_73,🎬,,,,0,,х,,,,,medium,
Squat on one leg (shin support on the wall),"Великий сідничний м'яз, Середній сідничний м'яз, Малий сідничний м'яз, Біцепс стегна","Gluteus, biceps femoris",6+,"Встань рівно, боком до стіни, опираючись гомілкою в стіну. Опорну ногу злегка зігни, спину тримай рівно. Погляд спрямований вперед. Присідай, тягнися куприком вниз. Притисни міцно до підлоги ступню опорної ноги (зберігай три точки опори). Неробоча нога, залишається нерухомою. Присідай, доки спина залишається рівною. ","Get straight, sideways, resting in the wall. The support leg is slightly bent, keep your back straight. The look directed forward. Squat, stretch the coccyx down. Press the foot of the support leg firmly to the floor (keep three points of support). The non -working leg remains stationary. Squat as long as your back remains flat.",Присідання на одній нозі (опора гомілкою на стіну),"Встань рівно, боком до стіни, опираючись гомілкою в стіну. Опорну ногу злегка зігни, спину тримай рівно. Погляд спрямований вперед. Присідай, тягнися куприком вниз. Притисни міцно до підлоги ступню опорної ноги (зберігай три точки опори). Неробоча нога, залишається нерухомою. Присідай, доки спина залишається рівною. ",,Glutes_74,🎬,🟢,,,0,,х,,,,,medium,
CLAIRS (SAFETY IN THE WORL),"Великий сідничний м'яз, Середній сідничний м'яз, Малий сідничний м'яз, Біцепс стегна","Gluteus, biceps femoris",8+,"Встань рівно, на відстані кроку від стіни, опираючись ступнею однієї ноги на стіну (під прямим кутом). Погляд спрямований вперед. Тримай спину рівно (від голови до куприка одна лінія). Опорну ногу злегка зігни. Нахиляйся, за рахунок тазостегнових суглобів, тягнучись сідницями назад. Коліно опороної ноги не рухоме, ступня міцно притиснута до підлоги. Видихаючи, розгинайся (шукай сідницями опору). Повтори іншою ногою.","The way is straight, at the distance of the wall, resting the foot of one leg on the wall (at right angles). The look directed forward. Keep your back straight (from head to coccyx one line). The support leg is slightly bent. Tilt, at the expense of the hip joints, pulling the buttocks back. The knee of the opposite leg is not moving, the foot is firmly pressed to the floor. Exhale, extend (look for a resistance buttocks). Repeat with another foot.",Станова тяга (опора в стіну),"Встань рівно, на відстані кроку від стіни, опираючись ступнею однієї ноги на стіну (під прямим кутом). Погляд спрямований вперед. Тримай спину рівно (від голови до куприка одна лінія). Опорну ногу злегка зігни. Нахиляйся, за рахунок тазостегнових суглобів, тягнучись сідницями назад. Коліно опороної ноги не рухоме, ступня міцно притиснута до підлоги. Видихаючи, розгинайся (шукай сідницями опору). Повтори іншою ногою. ",,Glutes_75,🎬,🟢,,,0,,х,,,,,medium,
CLAIRS (SPORTS IN THE Wall) with a rubber band,"Великий сідничний м'яз, Середній сідничний м'яз, Малий сідничний м'яз, Біцепс стегна","Gluteus, biceps femoris",8+,"Встань рівно, на відстані кроку від стіни, опираючись ступнею однієї ноги на стіну (під прямим кутом). Погляд спрямований вперед. Тримай спину рівно (від голови до куприка одна лінія). Опорну ногу злегка зігни. Візьми в руки резинку, наступи на неї. Нахиляйся, за рахунок тазостегнових суглобів, тягнучись сідницями назад. Коліно опороної ноги не рухоме, ступня міцно притиснута до підлоги. Видихаючи, розгинайся (шукай сідницями опору). Повтори іншою ногою. ","The way is straight, at the distance of the wall, resting the foot of one leg on the wall (at right angles). The look directed forward. Keep your back straight (from head to coccyx one line). The support leg is slightly bent. Take a rubber band, step on it. Tilt, at the expense of the hip joints, pulling the buttocks back. The knee of the opposite leg is not moving, the foot is firmly pressed to the floor. Exhale, extend (look for a resistance buttocks). Repeat with another foot.",Станова тяга (опора в стіну) з резинкою,"Встань рівно, на відстані кроку від стіни, опираючись ступнею однієї ноги на стіну (під прямим кутом). Погляд спрямований вперед. Тримай спину рівно (від голови до куприка одна лінія). Опорну ногу злегка зігни. Візьми в руки резинку, наступи на неї. Нахиляйся, за рахунок тазостегнових суглобів, тягнучись сідницями назад. Коліно опороної ноги не рухоме, ступня міцно притиснута до підлоги. Видихаючи, розгинайся (шукай сідницями опору). Повтори іншою ногою. ",,Glutes_76,,,,,резинка,,х,,,,,hard,
The class traction (wall support) with dumbbells,"Великий сідничний м'яз, Середній сідничний м'яз, Малий сідничний м'яз, Біцепс стегна","Gluteus, biceps femoris",8+,"Встань рівно, на відстані кроку від стіни, опираючись ступнею однієї ноги на стіну (під прямим кутом). Погляд спрямований вперед. Тримай спину рівно (від голови до куприка одна лінія). Опорну ногу злегка зігни. Гантелі тримай на плечах. Нахиляйся, за рахунок тазостегнових суглобів, тягнучись сідницями назад. Коліно опороної ноги не рухоме, ступня міцно притиснута до підлоги. Видихаючи, розгинайся (шукай сідницями опору). Повтори іншою ногою. ","The way is straight, at the distance of the wall, resting the foot of one leg on the wall (at right angles). The look directed forward. Keep your back straight (from head to coccyx one line). The support leg is slightly bent. Hold the dumbbells on your shoulders. Tilt, at the expense of the hip joints, pulling the buttocks back. The knee of the opposite leg is not moving, the foot is firmly pressed to the floor. Exhale, extend (look for a resistance buttocks). Repeat with another foot.",Станова тяга (опора в стіну) з гантелями,"Встань рівно, на відстані кроку від стіни, опираючись ступнею однієї ноги на стіну (під прямим кутом). Погляд спрямований вперед. Тримай спину рівно (від голови до куприка одна лінія). Опорну ногу злегка зігни. Гантелі тримай на плечах. Нахиляйся, за рахунок тазостегнових суглобів, тягнучись сідницями назад. Коліно опороної ноги не рухоме, ступня міцно притиснута до підлоги. Видихаючи, розгинайся (шукай сідницями опору). Повтори іншою ногою. ",,Glutes_77,,,,,гантелі,,х,,,,,hard,
Activation of the buttocks,"Великий сідничний м'яз, Середній сідничний м'яз, Малий сідничний м'яз",Gluteus,6+,"Ляж на живіт, руки збери в замок під лоба. Одну ногу зігни всторону, під прямим кутом. Видихаючи, відривай коліно цієї ноги від підлоги, при цьому ступня залишається притиснута до підлоги. ","Lie on your stomach, take your hands in the lock under the forehead. One leg bend the way, at right angles. Exhaling, tearing the knee of this leg from the floor, while the foot remains pressed to the floor.",Активація сідниць,"Ляж на живіт, руки збери в замок під лоба. Одну ногу зігни всторону, під прямим кутом. Видихаючи, відривай коліно цієї ноги від підлоги, при цьому ступня залишається притиснута до підлоги. ",,Glutes_78,🎬,🟢,,,0,х,,х,,,,hard,
