Часть тела / упражнение (Eng),Робочі м'язи / суглоби,Muscle in English,Min Age,Опис UA дорослі,Description (Eng),Частина тіла / вправа (Ukr),Опис UA діти,,ID,Записані,Редаговані,Доопрацьовані,,Інвентар,Розігрів,Сила,Гнучкість,Швидкість,Витривалість,Спритність / Координація,Складність,Animation
Cat soft rolling + relaxation,"Клубово-поперековий м'яз, Найширший м'яз спини, Найдовший м'яз спини","Lumbosacral, broadest muscles, thoracic spine.",5+,"Встань в колінно-кистьову позу.  Видихаючи прогни спину, тягнися грудьми вниз збираючи лопатки. Подивись вперед-вверх, перекатом сідай на п'ятки. Вдихаючи округли спину, тягнися лопатками вверх, голову опусти вниз, таз підкрути в себе. Вправу виконуй плавно. ","Get into the knee-acid pose. Exhaling your back, stretch your chest down to collect the shoulder blades. Look back and in the way, sway on your heels. Inhaling the rounded back, stretch the shoulder blades up, lower your head down, twist the pelvis. Perform the exercise smoothly.",Кішка м'які перекати + розслаблення,"Встань в колінно-кистьову позу.  Видихаючи прогни спину, тягнися грудьми вниз збираючи лопатки. Подивись вперед-вверх, перекатом сідай на п'ятки. Вдихаючи округли спину, тягнися лопатками вверх, голову опусти вниз, таз підкрути в себе. Вправу виконуй плавно. ",1,Back_95,🎬,,,,0,х,,х,,,,medium,
Stretching the scoliotic back (with scoliosis),"Клубово-поперековий м'яз, Найширший м'яз спини","Іliolumbar muscle, broadest muscles",4+,"Встань боком до стіни, на відстані витягнутої руки опираючись долонею в стіну. Ноги разом, погляд спрямований вперед. Протилежною рукою тягнися долонею до стіни, через верх. Таз залишається нерухомим. Виконай спочатку однією рукою, після поверних іншим боком і повтори іншою рукою.","Get sideways to the wall, at the distance of the extended hand, resting the palm into the wall. Legs together, the look directed forward. The opposite hand stretches your palm to the wall, through the top. The pelvis remains stationary. Perform first with one hand, after turning the other side and repetition with the other hand.",Розтягування сколіотичної спини  (при сколіозі),"Встань боком до стіни, на відстані витягнутої руки опираючись долонею в стіну. Ноги разом, погляд спрямований вперед. Протилежною рукою тягнися долонею до стіни, через верх. Таз залишається нерухомим. Виконай спочатку однією рукою, після поверних іншим боком і повтори іншою рукою.",,Back_96,🎬,🟢,,,0,х,,х,,,,easy,
Stretching scoliotic back in static (with scoliosis,"Клубово-поперековий м'яз, Найширший м'яз спини","Іliolumbar muscle, broadest muscles",5+,"Встань боком до стіни, на відстані кроку. Ноги разом, руки опущені, погляд спрямований вперед. Протилежною рукою тягнися долонею до стіни, через верх і затримайся в такому положенні. Таз залишається нерухомим. Виконай спочатку однією рукою, після поверних іншим боком і повтори іншою рукою. ","Get sideways to the wall, at a distance of the step. Legs together, arms lowered, look forward. With the opposite hand, reach the wall with your palm, through the top and hold in this position. The pelvis remains stationary. Perform first with one hand, after turning the other side and repetition with the other hand.",Розтягування сколіотичної спини в статиці (при сколіозі,"Встань боком до стіни, на відстані кроку. Ноги разом, руки опущені, погляд спрямований вперед. Протилежною рукою тягнися долонею до стіни, через верх і затримайся в такому положенні. Таз залишається нерухомим. Виконай спочатку однією рукою, після поверних іншим боком і повтори іншою рукою. ",,Back_97,🎬,🟢,,,0,х,,х,,,,easy,
Circular movements of the torso of the arm at the top,"Клубово-поперековий м'яз, Найширший м'яз спини","Іliolumbar muscle, broadest muscles",5+,"Встань рівно, збери руки вгорі взамок. Зафіксуй таз, виконуй коловий рух за рахунок поясниці. Виконай по чергово в кожну сторону.","Get straight, collect your hands at the top. Fix the pelvis, perform the circular movement at the expense of the belt. Do the next one in each direction.",Колові рухи тулуба руки вгорі,"Встань рівно, збери руки вгорі взамок. Зафіксуй таз, виконуй коловий рух за рахунок поясниці. Виконай по чергово в кожну сторону.",1,Back_99,🎬,🟢,,,0,х,,х,,,,,
Scroll in a wide rack in a slope,,"Іliolumbar muscle, broadest muscles",4+,"Встань в широку стійку ноги нарізно, на прямих ногах, дотягнувшись руками до підлоги. Постав одну руку за голову. Видихаючи, викручуйся ліктем вверх, погляд спрямовуй за ліктем. Повтори спочатку на одну руку, потім на іншу.","Stand in a wide stable leg apart, on straight legs, reaching your hands to the floor. Put one hand by the head. Exhaled, twist your elbow up, look at your elbow. Repeat first on one hand, then on the other.",Скрутка в широкій стійці в нахилі,"Встань в широку стійку ноги нарізно, на прямих ногах, дотягнувшись руками до підлоги. Постав одну руку за голову. Видихаючи, викручуйся ліктем вверх, погляд спрямовуй за ліктем. Повтори спочатку на одну руку, потім на іншу.",,Back_100,🎬,,,,0,х,,х,,,,,
Press,,,,,,Прес,,,,,,,,,,,,,,,,
Tightening,Прямий м'яз живота,Rectus abdominis muscle,4+,"Ляж на спину, ноги зігни, постав ширше ширини плечей. Руки на потилиц лікті всторони. Погляд спрямований вверх. Поясниця тісно прижата в підлогу. Видихаючи, скручуйся, відриваючи лопатки від підлоги, тягнися нижніми ребрами до тазових кісточок. Вдихаючи, розслабся.","Lie on your back, bend your legs, put wider shoulders width. Hands on the nape of the elbows. The look is directed up. The belt is tight to the floor. Exhaling, twist, tearing the shoulder blades from the floor, stretch the lower ribs to the pelvic bones. Inhaling, relax.",Cкручування,"Ляж на спину, ноги зігни, постав ширше ширини плечей. Руки на потилиці лікті всторони. Погляд спрямований вверх. Поясниця тісно прижата в підлогу. Видихаючи, скручуйся, відриваючи лопатки від підлоги. тягнися нижніми ребрами до тазових кісточок. Вдихаючи, розслабся.",,Core_1,🎬,,,,0,,х,,,x,,Easy,
Twisting the hand to the sides,Прямий м'яз живота,Rectus abdominis muscle,4+,"Ляж на спину, зігнувши ноги, постав ширше ширини плечей. Руки на потилиці лікті всторони. Погляд спрямований вверх. Поясниця тісно притиснута до підлоги. Видихаючи, скручуйся, відриваючи лопатки від підлоги, махом рук через сторони, тягнися нижніми ребрами до тазових кісточок. Вдихаючи, розслабся.","Lie on your back, bending your feet, put wider shoulders width. Hands on the nape of the elbows of the westerns. The look is directed up. The belt is closely pressed to the floor. Exhaling, twist, tearing the shoulder blades from the floor, swinging hands through the sides, stretch the lower ribs to the pelvic bones. Inhaling, relax.",Скручування руки в сторони,"Ляж на спину, зігнувши ноги, постав ширше ширини плечей. Руки на потилиці лікті всторони. Погляд спрямований вверх. Поясниця тісно притиснута до підлоги. Видихаючи, скручуйся, відриваючи лопатки від підлоги, махом рук через сторони, тягнися нижніми ребрами до тазових кісточок. Вдихаючи, розслабся.",,Core_2,🎬,,,,0,,х,,,х,,easy,
Twisting your hand up (as a variety can be held in your hands some object),Прямий м'яз живота,Rectus abdominis muscle,4+,"Ляж на спину, зігнувши ноги, постав ширше ширини плечей. Руки на потилиці лікті всторони. Погляд спрямований вверх. Поясниця тісно прижата в підлогу. Видихаючи, скручуйся, відриваючи лопатки від підлоги, тягнися нижніми ребрами до тазових кісточок, а руками вперед-вверх. Вдихаючи, розслабся.","Lie on your back, bending your feet, put wider shoulders width. Hands on the nape of the elbows of the westerns. The look is directed up. The belt is tight to the floor. Exhaling, twisting, tearing the shoulder blades from the floor, stretch the lower ribs to the pelvic bones, and hands back and up. Inhaling, relax.",Скручування руки вверх (як різновид можна тримати в руках якийсь предмет) ,"Ляж на спину, зігнувши ноги, постав ширше ширини плечей. Руки на потилиці лікті всторони. Погляд спрямований вверх. Поясниця тісно прижата в підлогу. Видихаючи, скручуйся, відриваючи лопатки від підлоги, тягнися нижніми ребрами до тазових кісточок, а руками вперед-вверх. Вдихаючи, розслабся.",,Core_3,🎬,,,,0,,х,,,х,,easy,
Twisting the leg on the nozzle,Прямий м'яз живота,Rectus abdominis muscle,6+,"Ляж на спину, тримай ноги на вису,зігнувши під прямим кутом. Руки на потилиці лікті всторони. Погляд спрямований вверх. Поясниця тісно прижата в підлогу. Видихаючи, скручуйся, відриваючи лопатки від підлоги. тягнися нижніми ребрами до тазових кісточок. Вдихаючи, розслабся.","Lie on your back, hold your feet on the weight, bending at right angles. Hands on the nape of the elbows of the westerns. The look is directed up. The belt is tight to the floor. Exhale, twist, tear off the blades from the floor. Stretch the lower ribs to the pelvic bones. Inhaling, relax.",Скручування ноги на вису ,"Ляж на спину, тримай ноги на вису,зігнувши під прямим кутом. Руки на потилиці лікті всторони. Погляд спрямований вверх. Поясниця тісно прижата в підлогу. Видихаючи, скручуйся, відриваючи лопатки від підлоги. тягнися нижніми ребрами до тазових кісточок. Вдихаючи, розслабся.",,Core_4,🎬,,,,0,,х,,,х,,medium,
"Twisting the legs on the weaver, arms of arrest",Прямий м'яз живота,Rectus abdominis muscle,6+,"Ляж на спину, ноги зігни, постав ширше ширини плечей. Руки на потилиці лікті всторони. Погляд спрямований вверх. Поясниця тісно прижата в підлогу. Видихаючи, скручуйся, відриваючи лопатки від підлоги, махом рук через сторони, тягнися до п’ят, а  нижніми ребрами до тазових кісточок. Вдихаючи, розслабся. ","Lie on your back, bend your legs, put wider shoulders width. Hands on the nape of the elbows of the westerns. The look is directed up. The belt is tight to the floor. Exhaling, twist, tearing the blades from the floor, swinging hands through the sides, reach the heels, and the lower ribs to the pelvic bones. Inhaling, relax.","Скручування ноги на вису, руки всторони ","Ляж на спину, ноги зігни, постав ширше ширини плечей. Руки на потилиці лікті всторони. Погляд спрямований вверх. Поясниця тісно прижата в підлогу. Видихаючи, скручуйся, відриваючи лопатки від підлоги, махом рук через сторони, тягнися до п’ят, а  нижніми ребрами до тазових кісточок. Вдихаючи, розслабся. ",,Core_5,🎬,,,,0,,х,,,х,,easy,
Twisting (palm to palm),Прямий м'яз живота,Rectus abdominis muscle,6+,"Ляж на спину, тримай ноги на вису,зігнувши під прямим кутом. Руки на потилиці лікті всторони. Погляд спрямований вверх. Поясниця тісно прижата в підлогу. Видихаючи, скручуйся, відриваючи лопатки від підлоги, тягнися руками одна до одної через сторони під колінами, а нижніми ребрами до тазових кісточок. Вдихаючи, розслабся. ","Lie on your back, hold your feet on the weight, bending at right angles. Hands on the nape of the elbows of the westerns. The look is directed up. The belt is tight to the floor. Exhaling, twisting, tearing the shoulder blades from the floor, stretch your hands to each other through the sides under the knees, and the lower ribs to the pelvic bones. Inhaling, relax.",Скручування (долоня до долоні),"Ляж на спину, тримай ноги на вису,зігнувши під прямим кутом. Руки на потилиці лікті всторони. Погляд спрямований вверх. Поясниця тісно прижата в підлогу. Видихаючи, скручуйся, відриваючи лопатки від підлоги, тягнися руками одна до одної через сторони під колінами, а нижніми ребрами до тазових кісточок. Вдихаючи, розслабся. ",,Core_6,🎬,,,,0,,х,,,,,medium,
"Twisting the legs on the support (bench, chair, bed",Прямий м'яз живота,Rectus abdominis muscle,4+,"Ляж на спину, ноги зігни, постав ширше ширини плечей, опираючись ступнями на лаву (стілець, ліжко). Руки на потилиці лікті всторони. Погляд спрямований вверх. Поясниця тісно прижата в підлогу. Видихаючи, скручуйся, відриваючи лопатки від підлоги. тягнися нижніми ребрами до тазових кісточок. Вдихаючи, розслабся.","Lie on your back, legs, put wider shoulders width, resting your feet on a bench (chair, bed). Hands on the nape of the elbows of the westerns. The look is directed up. The belt is tight to the floor. Exhale, twist, tear off the blades from the floor. Stretch the lower ribs to the pelvic bones. Inhaling, relax.","Скручування ноги на опорі (лава, стілець,ліжко","Ляж на спину, ноги зігни, постав ширше ширини плечей, опираючись ступнями на лаву (стілець, ліжко). Руки на потилиці лікті всторони. Погляд спрямований вверх. Поясниця тісно прижата в підлогу. Видихаючи, скручуйся, відриваючи лопатки від підлоги. тягнися нижніми ребрами до тазових кісточок. Вдихаючи, розслабся.",,Core_7,🎬,,,,0,,х,,,,,easy,
"Twisting the legs on the support (bench, chair, bed), arms wasting",Прямий м'яз живота,Rectus abdominis muscle,4+,"Ляж на спину, зігнувши ноги, постав ширше ширини плечей, опираючись ступнями на лаву (стілець, ліжко). Руки на потилиці лікті всторони. Погляд спрямований вверх. Поясниця тісно прижата в підлогу. Видихаючи, скручуйся, відриваючи лопатки від підлоги, махом рук через сторони, тягнися нижніми ребрами до тазових кісточок. Вдихаючи, розслабся.","Lie on your back, bending your legs, put wider shoulders width, resting your feet on a bench (chair, bed). Hands on the nape of the elbows of the westerns. The look is directed up. The belt is tight to the floor. Exhaling, twist, tearing the shoulder blades from the floor, swinging hands through the sides, stretch the lower ribs to the pelvic bones. Inhaling, relax.","Скручування ноги на опорі (лава, стілець,ліжко), руки всторони","Ляж на спину, зігнувши ноги, постав ширше ширини плечей, опираючись ступнями на лаву (стілець, ліжко). Руки на потилиці лікті всторони. Погляд спрямований вверх. Поясниця тісно прижата в підлогу. Видихаючи, скручуйся, відриваючи лопатки від підлоги, махом рук через сторони, тягнися нижніми ребрами до тазових кісточок. Вдихаючи, розслабся.",,Core_8,🎬,,,,0,,х,,,,,easy,
Twisting (fold on one foot),Прямий м'яз живота,Rectus abdominis muscle,5+,"Ляж на спину, одну ногу зігни, іншу випрям. Руки випрям назад. Видихаючи, скручуйся (одночасно тягнися пальцями рук до пальців ніг випрямленої ноги).  Вдихаючи, розслабся. Поясниця притиснута до підлоги, тягнися нижніми ребрами до тазових кісточок.Виконай спочатку на одну ногу, потім на іншу.","Lie on your back, bend one leg, another straightener. Hands straighten back. Exhale, twist (at the same time stretch your fingers to your toes with a straightened leg). Inhaling, relax. The belt is pressed to the floor, stretch the lower ribs to the pelvic bones. Perform first on one leg, then on the other.",Скручування (складка на одну ногу),"Ляж на спину, одну ногу зігни, іншу випрям. Руки випрям назад. Видихаючи, скручуйся (одночасно тягнися пальцями рук до пальців ніг випрямленої ноги).  Вдихаючи, розслабся. Поясниця притиснута до підлоги, тягнися нижніми ребрами до тазових кісточок.Виконай спочатку на одну ногу, потім на іншу.",,Core_9,🎬,,,,0,,х,,,,,medium,
Set-Apea to each leg,Прямий м'яз живота,Rectus abdominis muscle,4+,"Ляж на спину, зігнувши ноги, постав ширше ширини плечей. Руки випрям назад. Погляд спрямований вверх. Видихаючи, скручуйся, руками тягнися до підлоги, так, щоб ступні була між долонями. Вдихаючи, розслабся. Почергово скручуйся до кождної ноги.","Lie on your back, bending your feet, put wider shoulders width. Hands straighten back. The look is directed up. Exhaled, twist, with your hands reach the floor, so that the feet are between the palms. Inhaling, relax. Twist in turn to each leg.",Сет-апи до кожної ноги,"Ляж на спину, зігнувши ноги, постав ширше ширини плечей. Руки випрям назад. Погляд спрямований вверх.  Видихаючи, скручуйся, руками тягнися до підлоги, так, щоб ступня була між долонями. Вдихаючи, розслабся. Почергово скручуйся до кождної ноги.",,Core_10,🎬,,,,0,,х,,,,,medium,
"SET-APA ""Attention""",Прямий м'яз живота,Rectus abdominis muscle,6+,"Ляж на спину, ноги зігнути в колінах на ширині плечей. Руки всторони. Погляд спрямований вверх. Поясниця тісно притиснута до підлоги. Видихаючи, скручуйся: 1- відриваючи лопатки і поясницю від підлоги. тягнися руками до стегон. Вдихаючи, розслабся; 2 -  тягнися руками до колін,Вдихаючи, розслабся; 3 - тягнися руками до пільців ніг, Вдихаючи, розслабся;","Lie on your back, bend your knees at your shoulders width. Hands of ustrons. The look is directed up. The belt is closely pressed to the floor. Exhale, twist: 1- tear off the shoulder blades and a belt from the floor. He extends his hands to his thighs. Inhaling, relax; 2 - stretch your hands to your knees, inhaling, relax; 3 - stretch your hands to your feet, inhaling, relax;",Сет-апи «Увага»,"Ляж на спину, ноги зігнути в колінах на ширині плечей. Руки всторони. Погляд спрямований вверх. Поясниця тісно притиснута до підлоги. Видихаючи, скручуйся: 1- відриваючи лопатки і поясницю від підлоги. тягнися руками до стегон. Вдихаючи, розслабся; 2 -  тягнися руками до колін,Вдихаючи, розслабся; 3 - тягнися руками до пільців ніг, Вдихаючи, розслабся;",,Core_11,🎬,,,,0,,х,,,,,medium,
